{
  "phase": "DEPLOYMENT",
  "status": "completed",
  "startTime": "2026-04-02T14:40:00Z",
  "endTime": "2026-04-02T15:10:00Z",
  "durationMs": 1800000,
  "qualityScore": 85,
  "artifacts": [
    {
      "name": "delivery-manifest",
      "path": "docs/runs/run-2026-04-cycle-01/delivery-manifest.json",
      "required": true,
      "exists": true
    }
  ],
  "errors": [],
  "summary": "DEPLOYMENT 准备完成，交付清单和发布占位制品已就位。",
  "branchId": "branch-prd-ai-content-trial",
  "prdId": "PRD-AI-CONTENT-TRIAL",
  "metadata": {
    "runId": "run-2026-04-cycle-01",
    "host": "copilot-chat",
    "sampleBacked": true
  }
}